{
  "prompt_id": "PRM_MP_CHAR_SILLA_ELITE_OBSERVER_01_THREE_QUARTER_RIGHT_V03",
  "shot_id": "MASTER_PACK:CHAR_SILLA_ELITE_OBSERVER_01:three_quarter_right",
  "target": "IMAGE",
  "locks": {
    "global": "DDABONG_GLOBAL_V01",
    "era": "SILLA_EARLY_V01",
    "location": "NONE",
    "character_costume": [
      "CHAR_SILLA_ELITE_OBSERVER_01_LOCK_V02+COSTUME_SILLA_ELITE_A01_LOCK_V02"
    ],
    "style": "DDABONG_SAGEUK_CINEMATIC_V02",
    "camera": null
  },
  "shot_delta": "MASTER PACK slot THREE-QUARTER RIGHT: head and shoulders, face turned 45 degrees to camera-right, neutral expression, soft daylight, plain background.",
  "negative": [
    "Joseon dynasty hanbok",
    "gat hats",
    "Ming or Qing court robes",
    "samurai armor",
    "European medieval armor",
    "fantasy armor",
    "giant stone palace",
    "Chinese imperial palace",
    "pagoda skyline",
    "torii gates",
    "modern tools",
    "excavators",
    "cranes",
    "concrete",
    "electric lights",
    "plastic",
    "modern roads",
    "supernatural ghosts",
    "glowing magic",
    "fantasy crown",
    "exaggerated crying",
    "battle scene",
    "cinematic war spectacle",
    "modern museum display cases",
    "text",
    "watermark",
    "glossy skin",
    "malformed anatomy",
    "plastic skin",
    "waxy complexion",
    "uncanny smooth skin",
    "blurred or deformed hands",
    "extra fingers",
    "shadow direction flip",
    "inconsistent light direction",
    "wardrobe colour change",
    "identical faces on different people",
    "anime",
    "illustration",
    "3D render look",
    "readable text",
    "captions",
    "subtitles",
    "logo",
    "gold crown",
    "silver or gold belt plaques",
    "purple",
    "crimson",
    "Joseon-style tiled palace compound",
    "stone mausoleum / pyramid / Chinese-style tomb gateway",
    "modern tools, excavators, cranes, wheeled modern carts",
    "concrete, electric lights, plastic, modern roads",
    "supernatural ghosts, glowing magic, fantasy crown",
    "Joseon royal or official robes",
    "Ming/Qing imperial dress",
    "fantasy king styling",
    "short sleeves",
    "half-sleeve over-garment",
    "deep V crossover",
    "tall pointed cap",
    "bronze belt",
    "futou hat",
    "round-collar danryeong",
    "gold belt",
    "Tang-style futou hat",
    "Joseon hanbok"
  ],
  "assembled_text": "Photorealistic cinematic historical documentary. Natural physical proportions. Historically plausible reconstruction. Realistic materials. Natural lighting. No fantasy. No modern objects. No text. No logos. No excessive saturation. No glossy AI look. No malformed anatomy. No arbitrary architecture changes. Early Silla, Gyeongju royal capital, 5th to early 6th century. Elite burial construction context. Modest timber work spaces, no palace spectacle. Forbidden: Joseon dynasty hanbok; gat hats; Ming or Qing court robes; samurai armor; European medieval armor; fantasy armor; giant stone palace; Joseon-style tiled palace compound; Chinese imperial palace; pagoda skyline; torii gates; stone mausoleum / pyramid / Chinese-style tomb gateway; modern tools, excavators, cranes, wheeled modern carts; concrete, electric lights, plastic, modern roads; supernatural ghosts, glowing magic, fantasy crown; modern museum display cases. CHAR_SILLA_ELITE_OBSERVER_01 (Senior elite observer, recast D-051): senior member of the elite watching mound construction and funeral preparation from a distance; not the deceased, not a king. Face (LOCKED, distinct): Korean man in his early 50s cast like a veteran Korean drama actor - long oval face, high flat cheekbones, deep-set narrow dark eyes with heavy upper lids and crow's-feet, straight nose with a slightly wide bridge, thin firm mouth with a faint downward set, a short old scar through the left eyebrow, weathered olive skin with visible pores and sun lines on the forehead, salt-and-pepper temples. Not a portrait of any real person. Expression: restrained, watchful, tired authority. Body: lean, upright still posture, 172 cm. Hair: tied up under the period headwear of COSTUME_SILLA_ELITE_A01. Skin: real texture, no gloss. Costume lock: COSTUME_SILLA_ELITE_A01_LOCK. COSTUME_SILLA_ELITE_A01 V02 (D-052, evidence-corrected): Silla senior elite observer, 5th to early 6th century, PROBABLE. ONE long-sleeved outer jacket-robe (jangyu) in muted grey-blue silk, hip-length or a little longer, with a STRAIGHT collar crossed SHALLOWLY right over left - no deep V, no wide open chest; only a thin line of the ivory hemp under-jacket shows at the collar. Sleeves are long and moderately wide, reaching the wrist. NO short-sleeved over-garment, NO layered short sleeve over long sleeve. No contrasting edging bands. Wide trousers gathered at the ankle; ankle boots over socks. Belt: a leather belt with a row of SILVER (or gilt-bronze) plaques and at most three short pendant drops - never gold plaques, never bronze or iron, never the long dangling Cheonmachong gold belt. Headwear: a LOW birch-bark cap with a blunt rounded top (gokkal shape), covered in plain silk, sitting close to the head - never a tall pointed cone, never a gold or gilt crown or gold cap ornament. Colours: grey-blue and ivory; never purple, never crimson. Forbidden: short sleeves, deep V crossover, gold crown, gold belt, bronze belt, tall pointed cap, Tang-style futou hat, round-collar danryeong, Joseon hanbok. DDABONG Sageuk Cinematic Reenactment (style B2, D-051): photoreal Korean period-drama film look. Faces cast like contemporary Korean drama actors - attractive, natural, distinct from one another, never a portrait of a real person; real skin texture with visible pores, fine lines and sun marks, no gloss, no wax, no plastic. Clothing, hair, ornaments and tools strictly historically researched (early Silla), never Joseon hanbok, never fantasy. Lighting: low golden key light from a 45-degree side, soft atmospheric haze, thin warm rim light on hair and shoulders, shallow depth of field, fine film grain; night scenes lit by amber torch or lamp light against cool blue shadow. Colour: deep saturated fabrics, earth and metal, natural sky and skin, not over-saturated, not anime, not illustration. Figures still and composed; wide and medium framing preferred, faces often in profile, silhouette or backlight. REFERENCE RULE: the attached reference image (job 46880b62) is the ONLY source for this man's face, age, skin, eyebrow scar, salt-and-pepper temples, and for his clothing and cap - the same grey-blue long-sleeved straight-collar robe with shallow right-over-left crossover, ivory under-collar line, leather belt with silver plaques and three short pendants, low blunt silk-covered birch-bark cap. Reproduce them exactly; same person, same outfit, no changes. Photoreal still, same golden late-afternoon light quality and film grain as the reference, plain soft earth-and-sky background unless stated. Exactly ONE person. No text, no watermark, no logo. MASTER PACK slot THREE-QUARTER RIGHT: head and shoulders, face turned 45 degrees to camera-right, neutral expression, soft daylight, plain background.",
  "reference_images": [
    "generation:GEN_MP_ELITE_HERO_RECAST_HIGGSFIELD_V07"
  ],
  "version": "V03",
  "parent_prompt_id": "PRM_MP_CHAR_SILLA_ELITE_OBSERVER_01_THREE_QUARTER_RIGHT_V02",
  "patch_id": null,
  "created_at": "2026-09-15",
  "created_by": "Claude Code (D-052 master pack recast, saved before sending - Sent Prompt Rule)"
}
