{
  "prompt_id": "PRM_PA_EP01_S03_SH001_V01",
  "shot_id": "EP01_S03_SH001",
  "target": "IMAGE",
  "locks": {
    "global": "DDABONG_GLOBAL_PRESENT_V01",
    "era": "NONE",
    "location": "NONE",
    "character_costume": [],
    "style": "DDABONG_DOC_REENACTMENT_V01",
    "camera": null
  },
  "shot_delta": "Cheonmachong entrance: stone lintel with the carved characters 天馬塚 and the grassy mound top above",
  "negative": [
    "text",
    "watermark",
    "logo",
    "signage",
    "lens flare",
    "HDR look",
    "oversaturation",
    "glossy AI look",
    "malformed anatomy",
    "identifiable faces",
    "invented buildings not in the reference",
    "altered landform or mound proportions",
    "fantasy elements",
    "historical costume figures",
    "vehicles",
    "crowds",
    "drone or aerial perspective unless in the reference"
  ],
  "assembled_text": "Photorealistic present-day documentary still, reconstructed from a licensed reference photograph. Keep the real landform, silhouette and proportions of the reference; change only season, light, weather and clutter as instructed. Natural lighting, neutral grade, realistic materials. Present-day surroundings (paths, trees, distant town) allowed only as they exist in the reference. No fantasy. No invented buildings. No text. No logos. No oversaturation. No glossy AI look. No malformed anatomy. Present-day Cheonmachong (Heavenly Horse Tomb) entrance, Daereungwon, Gyeongju, South Korea. Photorealistic documentary still, 16:9, 4K master. Keep from the reference: the exact granite entrance lintel with the three carved characters 天馬塚 (exactly these characters, same size and spacing, at y≈0.45), the green grass mound top curving above it (crest at y≈0.22), the dark open doorway below and the small green lamp. Change: season → early summer; light → soft overcast daylight; weather → thin high cloud; remove all people, paper notices and modern clutter; the carved characters must remain legible and unchanged. Camera: 35 mm, height 1.6 m, tilt 0°, static tripod frame. Grass fresh green; sky pale grey-blue. Documentary tone, neutral grade, slight film grain acceptable. Style B Documentary Reenactment look: natural textures, not glossy. No text, no watermark, no lens flare, no HDR look, no oversaturation.",
  "reference_images": [
    "rights:RTS_COMMONS_CHEONMACHONG_SIGN_MIETCHEN_001"
  ],
  "version": "V01",
  "parent_prompt_id": null,
  "patch_id": null,
  "created_at": "2026-09-14",
  "created_by": "Claude Code (PHOTO_AI_REDESIGN_V01 template, D-039 batch 1; saved before sending - Sent Prompt Rule)"
}
