{
  "prompt_id": "PRM_EP01_INSERT_HWANGNAM_V01",
  "shot_id": "EP01_S08_SH002",
  "target": "VIDEO",
  "locks": {
    "global": "DDABONG_GLOBAL_V01",
    "era": "SILLA_EARLY_V01",
    "location": "LOC_CHEONMACHONG_V01",
    "character_costume": [],
    "style": "DDABONG_SAGEUK_CINEMATIC_V02",
    "camera": null
  },
  "shot_delta": "Insert 2 (scale comparison, FACT CLM_EP01_STRUCT_012 + CLM_EP01_STRUCT_004): Cheonmachong 47 m / 12.7 m beside Hwangnamdaechong twin mound 120 m / 23 m, both at true scale in one Blender plate. Aerial glide instead of the section orbit. Same recipe as the G04 master take: short prompt, materials and camera only, metre values kept (they render as labels and are covered by edit overlays per D-059).",
  "negative": [
    "Joseon dynasty hanbok",
    "gat hats",
    "Ming or Qing court robes",
    "samurai armor",
    "European medieval armor",
    "fantasy armor",
    "giant stone palace",
    "Chinese imperial palace",
    "pagoda skyline",
    "torii gates",
    "modern tools",
    "excavators",
    "cranes",
    "concrete",
    "electric lights",
    "plastic",
    "modern roads",
    "supernatural ghosts",
    "glowing magic",
    "fantasy crown",
    "exaggerated crying",
    "battle scene",
    "cinematic war spectacle",
    "modern museum display cases",
    "text",
    "watermark",
    "glossy skin",
    "malformed anatomy",
    "plastic skin",
    "waxy complexion",
    "uncanny smooth skin",
    "blurred or deformed hands",
    "extra fingers",
    "shadow direction flip",
    "inconsistent light direction",
    "wardrobe colour change",
    "identical faces on different people",
    "anime",
    "illustration",
    "3D render look",
    "readable text",
    "captions",
    "subtitles",
    "logo",
    "gold crown",
    "silver or gold belt plaques",
    "purple",
    "crimson",
    "Joseon-style tiled palace compound",
    "stone mausoleum / pyramid / Chinese-style tomb gateway",
    "modern tools, excavators, cranes, wheeled modern carts",
    "concrete, electric lights, plastic, modern roads",
    "supernatural ghosts, glowing magic, fantasy crown",
    "Joseon royal or official robes",
    "Ming/Qing imperial dress",
    "fantasy king styling",
    "short sleeves",
    "half-sleeve over-garment",
    "deep V crossover",
    "tall pointed cap",
    "bronze belt",
    "futou hat",
    "round-collar danryeong",
    "gold belt",
    "Tang-style futou hat",
    "Joseon hanbok",
    "modern fences",
    "park lawn",
    "paved paths",
    "visitors",
    "scaffolding outside the stone pile",
    "river beside the site",
    "3D render look",
    "clay render",
    "grey untextured surfaces",
    "flat grey sky",
    "outer scaffolding",
    "timber platforms outside the mound",
    "labels",
    "logos",
    "people",
    "flicker",
    "sky",
    "texture change"
  ],
  "assembled_text": "Technical architectural size comparison, aerial view over an ancient Korean royal tomb field at true scale. On the left a single round earthen mound 47 metres across and 12.7 metres tall. On the right a twin mound, two joined domes forming one gourd-shaped tomb 120 metres long and 23 metres tall, visibly far larger than the one on the left. Both are smooth grassed earth mounds on a flat plain with low wooded hills far behind. The camera drifts slowly forward and slightly down, a gentle aerial glide, so the size difference between the two tombs reads clearly. The glowing cobalt-blue structure lines stay crisp and continuous on both mounds throughout as an overlay. Dark neutral grey ground, dim overcast sky. Subtle floating dust motes only. No people, no text, no labels, no logos, no flicker, no extra tombs. Steady, deliberate, museum-exhibit pacing.",
  "reference_images": [
    "08_GENERATION_CACHE/EP01/HERITAGE_INSERT/CAM_INSERT_HWANGNAM_SCALE_tech.png"
  ],
  "version": "V01",
  "parent_prompt_id": "PRM_EP01_INSERT_G04_V04",
  "patch_id": "",
  "created_at": "2026-09-19",
  "created_by": "Claude Code (P-015 #5)"
}