{
  "prompt_id": "PRM_EP01_S04_SH004_START_V01",
  "shot_id": "EP01_S04_SH004",
  "target": "IMAGE",
  "locks": {
    "global": "DDABONG_GLOBAL_V01",
    "era": "SILLA_EARLY_V01",
    "location": "LOC_CHEONMACHONG_V01",
    "character_costume": [
      "CHAR_SILLA_LABORER_GROUP_01_LOCK+COSTUME_SILLA_LABORER_A01_LOCK"
    ],
    "style": "DDABONG_DOC_REENACTMENT_V01",
    "camera": "CAMERA_EP01_S04_SH004_V01"
  },
  "shot_delta": "H01 start still: timber yard close to labourers preparing chamber beams; 35mm feel, 1.4 m; S04 master frame as layout-only reference, faces by text",
  "negative": [
    "Joseon dynasty hanbok",
    "gat hats",
    "Ming or Qing court robes",
    "samurai armor",
    "European medieval armor",
    "fantasy armor",
    "giant stone palace",
    "Chinese imperial palace",
    "pagoda skyline",
    "torii gates",
    "modern tools",
    "excavators",
    "cranes",
    "concrete",
    "electric lights",
    "plastic",
    "modern roads",
    "supernatural ghosts",
    "glowing magic",
    "fantasy crown",
    "exaggerated crying",
    "battle scene",
    "cinematic war spectacle",
    "modern museum display cases",
    "text",
    "watermark",
    "glossy skin",
    "malformed anatomy",
    "Joseon-style tiled palace compound",
    "stone mausoleum / pyramid / Chinese-style tomb gateway",
    "modern tools, excavators, cranes, wheeled modern carts",
    "concrete, electric lights, plastic, modern roads",
    "supernatural ghosts, glowing magic, fantasy crown",
    "Joseon hanbok silhouette",
    "gat hat",
    "Ming/Qing dress",
    "samurai elements",
    "modern fabric",
    "purple/crimson/blue/yellow official colours",
    "cloned or repeated faces",
    "people looking at the camera",
    "metal tools",
    "utility poles",
    "power lines",
    "buildings on the horizon",
    "black bars or letterbox"
  ],
  "assembled_text": "One documentary photograph that fills the entire 16:9 frame edge to edge, a single still image; no black bars, no letterbox, no borders. Early Silla, Gyeongju, 5th century: the timber yard beside the Cheonmachong burial site at an early construction stage. In the foreground and middle ground a small team of labourers prepares thick timber beams for the wooden burial chamber: two men lift one end of a long squared beam together, one lays a straight wooden measuring stick along a beam, one drives a wooden wedge with a wooden mallet, two others roll a log on wooden rollers with rope. Behind them, slightly out of focus, the open-topped rectangular wooden chamber of thick beams stands on levelled ground, with only a low course of river stones beginning along its outer walls; nothing covers the chamber and no earth mound has been raised. Everyone in the image is a labourer in undyed coarse hemp short jackets to hip length wrapped right over left with cloth waist cords, narrow trousers bound at the shin, straw sandals or bare feet; colours only natural off-white, raw fibre and a few black jackets. Every labourer is a clearly different individual: mixed ages from about 20 to 45, different face shapes and skin tones from sun, some clean-shaven, some with short stubble, only a few with beards; different heights and builds from thin to stocky; some with a cloth headband, some with a bare topknot; no two people look alike, no repeated or cloned faces, no hero figure. Tools only: straw baskets, rope, shoulder poles, wooden mallets, wooden wedges and all-wooden spades. Every tool is made entirely of wood: no metal blades, no metal heads, no saws, no axes, no pick-axes, no measuring tapes, nothing yellow or modern in anyone's hands. In the far background only bare low hills, open untilled land and a few trees: no utility poles, no power lines, no buildings, no greenhouses, no roads, no regular field grid. No one looks at the camera, no one poses, restrained working expressions, physical effort. Camera about 1.4 metres high at eye level beside the workers, 35mm lens feel, medium-wide view along the beams, cool overcast morning light, dust in the air. Photorealistic historical documentary still, style B Documentary Reenactment, natural textures and skin, not glossy, earthy natural colours. No tiled roofs, no stone walls, no modern objects, no rubber wheels, no cranes, no gold objects visible, no crown visible, no text, no watermark, no logo.",
  "reference_images": [],
  "version": "V01",
  "parent_prompt_id": null,
  "patch_id": null,
  "created_at": "2026-09-13",
  "created_by": "Image/Video Generation Agent (Claude Code) - draft, saved before any sending (D-016), not approved | text-only per D-027 crowd reference rule (master-frame reference removed by orchestrator)"
}
