{
  "prompt_id": "PRM_EP01_S06_SH010_V03",
  "shot_id": "EP01_S06_SH010",
  "target": "IMAGE",
  "locks": {
    "global": "DDABONG_GLOBAL_V01",
    "era": "SILLA_EARLY_V01",
    "location": "LOC_CHEONMACHONG_V01",
    "character_costume": [
      "CHAR_SILLA_ATTENDANT_GROUP_01_LOCK+COSTUME_SILLA_ATTENDANT_A01_LOCK"
    ],
    "style": "DDABONG_DOC_REENACTMENT_V01",
    "camera": "CAMERA_EP01_S06_SH010_V01"
  },
  "shot_delta": "H06 retry: gentle low dome (height ~1/4 width), camera far back 35mm, empty man-made-free horizon, no reference image",
  "negative": [
    "Joseon dynasty hanbok",
    "gat hats",
    "Ming or Qing court robes",
    "samurai armor",
    "European medieval armor",
    "fantasy armor",
    "giant stone palace",
    "Chinese imperial palace",
    "pagoda skyline",
    "torii gates",
    "modern tools",
    "excavators",
    "cranes",
    "concrete",
    "electric lights",
    "plastic",
    "modern roads",
    "supernatural ghosts",
    "glowing magic",
    "fantasy crown",
    "exaggerated crying",
    "battle scene",
    "cinematic war spectacle",
    "modern museum display cases",
    "text",
    "watermark",
    "glossy skin",
    "malformed anatomy",
    "Joseon-style tiled palace compound",
    "stone mausoleum / pyramid / Chinese-style tomb gateway",
    "modern tools, excavators, cranes, wheeled modern carts",
    "concrete, electric lights, plastic, modern roads",
    "supernatural ghosts, glowing magic, fantasy crown",
    "Joseon hanbok silhouette",
    "court robes",
    "fantasy priest robes",
    "Chinese imperial dress",
    "official four colours"
  ],
  "assembled_text": "One wide documentary photograph that fills the entire 16:9 frame edge to edge, a single still image; no black bars, no letterbox, no borders. Early Silla, Gyeongju, 5th century: the Cheonmachong earth mound nearly completed, seen from far away. The mound is a very broad, low, gently sloping dome of freshly packed earth, about 47 metres across and only 12.7 metres high: its height is barely a quarter of its width, the slopes are gentle, about 25 to 30 degrees, and the top is a wide rounded crown, not a peak; the last bare patches are being smoothed near the top; no stones, timber or chamber visible anywhere. Small groups of people stand near its base for scale; a person about 1.6 metres tall is only about one eighth of the mound's height and looks tiny against it. They are labourers in undyed coarse hemp and funeral attendants in belted white, black and grey-brown hemp jackets; all different faces, no one in blue, no one posing, no one looking at the camera. Camera about 1.7 metres high, standing far back, about 60 metres from the mound, 35mm lens feel, so the whole mound sits in the middle of the frame with open ground on both sides; static wide view, low warm sunlight from the side, long shadows, calm and permanent, not celebratory. The horizon is empty early countryside - only bare low hills and a few trees, nothing man-made anywhere: no utility poles, no power lines, no buildings, no sheds, no roads, no fences, no regular field grid, no modern objects. Photorealistic historical documentary still, style B Documentary Reenactment, natural textures, not glossy, earthy natural colours. No tiled roofs, no stone walls, no manicured grass lawn, no gold objects, no crown, no text, no watermark, no logo.",
  "reference_images": [],
  "version": "V03",
  "parent_prompt_id": "PRM_EP01_S06_SH010_V02",
  "patch_id": "PATCH_EP01_S06_SH010_001",
  "created_at": "2026-09-13",
  "created_by": "Image Generation Agent (Claude Code) - retry, saved before sending (D-016), D-028 D4 call 2/2"
}
