{
  "prompt_id": "PRM_EP01_S05_SH005_START_V01",
  "shot_id": "EP01_S05_SH005",
  "target": "IMAGE",
  "locks": {
    "global": "DDABONG_GLOBAL_V01",
    "era": "SILLA_EARLY_V01",
    "location": "LOC_CHEONMACHONG_V01",
    "character_costume": [
      "CHAR_SILLA_ATTENDANT_GROUP_01_LOCK+COSTUME_SILLA_ATTENDANT_A01_LOCK"
    ],
    "style": "DDABONG_DOC_REENACTMENT_V01",
    "camera": "CAMERA_EP01_S05_SH005_V01"
  },
  "shot_delta": "H03 start still: close hands of attendants selecting and wrapping plain grave goods; attendant costume by text only, no reference image; at most one real Silla gold form (girdle plaque section), no fantasy jewels",
  "negative": [
    "Joseon dynasty hanbok",
    "gat hats",
    "Ming or Qing court robes",
    "samurai armor",
    "European medieval armor",
    "fantasy armor",
    "giant stone palace",
    "Chinese imperial palace",
    "pagoda skyline",
    "torii gates",
    "modern tools",
    "excavators",
    "cranes",
    "concrete",
    "electric lights",
    "plastic",
    "modern roads",
    "supernatural ghosts",
    "glowing magic",
    "fantasy crown",
    "exaggerated crying",
    "battle scene",
    "cinematic war spectacle",
    "modern museum display cases",
    "text",
    "watermark",
    "glossy skin",
    "malformed anatomy",
    "Joseon-style tiled palace compound",
    "stone mausoleum / pyramid / Chinese-style tomb gateway",
    "modern tools, excavators, cranes, wheeled modern carts",
    "concrete, electric lights, plastic, modern roads",
    "supernatural ghosts, glowing magic, fantasy crown",
    "Joseon hanbok silhouette",
    "court robes",
    "fantasy priest robes",
    "Chinese imperial dress",
    "official four colours",
    "cloned or repeated faces",
    "people looking at the camera",
    "metal tools",
    "utility poles",
    "power lines",
    "buildings on the horizon",
    "black bars or letterbox",
    "fantasy jewels",
    "gemstones",
    "museum labels or stands"
  ],
  "assembled_text": "One documentary photograph that fills the entire 16:9 frame edge to edge, a single still image; no black bars, no letterbox, no borders. Early Silla, Gyeongju, 5th century: close view of the hands of funeral attendants preparing grave goods on a low plain wooden plank table before burial. Hands come first: one pair of hands folds undyed hemp cloth over a grey-black stoneware stemmed cup and ties it with a plain cord; another pair of hands lifts a small grey stoneware jar to look at it; a third pair rests on a folded cloth bundle. On the table: plain grey-black Silla stoneware jars and stemmed cups, folded undyed hemp cloths, plain cord. If any gold is visible it is only one small, partly wrapped section of a real Silla gold girdle: square openwork gold plaques with long thin hanging gold strips, plain hammered gold with no gemstones, no jewels, no glow, no crown. The attendants wear finer undyed hemp or ramie jackets with narrow sleeves, wrapped right over left and closed only by plain cloth belts, no ribbon ties; colours only undyed white, black and grey-brown; the narrow sleeve ends and wrists read clearly. The hands belong to different people: different ages from about 20 to 50, men and one woman, different skin tones and hand shapes; faces are mostly out of frame above the chin, and any partly visible face is a different person, calm and focused, not looking at the camera. Background soft and out of focus: plain earth floor and timber posts of a simple work shelter, no tiled roof. Camera about 1.0 metre high, at table height, close 50mm lens feel, shallow depth of field, soft indirect daylight. Photorealistic historical documentary still, style B Documentary Reenactment, natural skin and fabric textures, not glossy, earthy natural colours. Not a museum display: no glass cases, no labels, no stands, no spotlights. No fantasy jewels, no gemstones, no crown, no modern objects, no metal tools, no text, no watermark, no logo.",
  "reference_images": [],
  "version": "V01",
  "parent_prompt_id": null,
  "patch_id": null,
  "created_at": "2026-09-13",
  "created_by": "Image/Video Generation Agent (Claude Code) - draft, saved before any sending (D-016), not approved | lens aligned to CAMERA_EP01_S05_SH005_V01 (50mm) by orchestrator"
}
