{
  "prompt_id": "PRM_MP_CHAR_SILLA_ELITE_OBSERVER_01_FRONT_V01",
  "shot_id": "MASTER_PACK:CHAR_SILLA_ELITE_OBSERVER_01:front",
  "target": "IMAGE",
  "locks": {
    "global": "DDABONG_GLOBAL_V01",
    "era": "SILLA_EARLY_V01",
    "location": "LOC_CHEONMACHONG_V01",
    "character_costume": [
      "CHAR_SILLA_ELITE_OBSERVER_01_LOCK+COSTUME_SILLA_ELITE_A01_LOCK"
    ],
    "style": "DDABONG_DOC_REENACTMENT_V01",
    "camera": null
  },
  "shot_delta": "front view, neutral expression, full head and shoulders, flat even daylight",
  "negative": [
    "Joseon dynasty hanbok",
    "gat hats",
    "Ming or Qing court robes",
    "samurai armor",
    "European medieval armor",
    "fantasy armor",
    "giant stone palace",
    "Chinese imperial palace",
    "pagoda skyline",
    "torii gates",
    "modern tools",
    "excavators",
    "cranes",
    "concrete",
    "electric lights",
    "plastic",
    "modern roads",
    "supernatural ghosts",
    "glowing magic",
    "fantasy crown",
    "exaggerated crying",
    "battle scene",
    "cinematic war spectacle",
    "modern museum display cases",
    "text",
    "watermark",
    "glossy skin",
    "malformed anatomy"
  ],
  "assembled_text": "Photorealistic cinematic historical documentary. Natural physical proportions. Historically plausible reconstruction. Realistic materials. Natural lighting. No fantasy. No modern objects. No text. No logos. No excessive saturation. No glossy AI look. No malformed anatomy. No arbitrary architecture changes. [SILLA_EARLY_V01] Early Silla, Gyeongju royal capital, 5th to early 6th century. Elite burial construction context. Modest timber work spaces, no palace spectacle. Forbidden: Joseon dynasty hanbok; gat hats; Ming or Qing court robes; samurai armor; European medieval armor; fantasy armor; giant stone palace; Joseon-style tiled palace compound; Chinese imperial palace; pagoda skyline; torii gates; stone mausoleum / pyramid / Chinese-style tomb gateway; modern tools, excavators, cranes, wheeled modern carts; concrete, electric lights, plastic, modern roads; supernatural ghosts, glowing magic, fantasy crown; modern museum display cases. [LOC_CHEONMACHONG_V01] Cheonmachong under construction, Gyeongju: stone-mound wooden-chamber tomb. Wooden outer chamber 6.6 x 4.2 m, coffin inside, river stones piled above and around the chamber, earth mound finishing at about 47 m diameter and 12.7 m height. Layer order: coffin and grave-goods chest, wooden chamber, stones, earth. Do not invent stone-pile thickness, work duration, headcount or ritual order. [CHAR_SILLA_ELITE_OBSERVER_01_LOCK] CHAR_SILLA_ELITE_OBSERVER_01 (Senior elite observer): 봉분 조성·장례 준비를 떨어져서 지켜보는 지배층 원로 (H04 원로, H05 관찰자). Face: realistic Korean facial proportions, restrained expression, not a portrait of any named historical person. Body: natural, medium build, upright still posture. Hair: tied up, period-appropriate — final form follows COSTUME_SILLA_ELITE_A01 headwear. Age: 40s–50s. Skin: natural texture, weathered, no gloss. Costume lock: COSTUME_SILLA_ELITE_A01_LOCK. [COSTUME_SILLA_ELITE_A01_LOCK] COSTUME_SILLA_ELITE_A01: Silla senior elite observer (PROBABLE; colour and belt INTERPRETIVE): silk outer robe over hemp/ramie inner jacket; narrow-sleeved jacket under a longer outer robe, straight collar closing right over left, rounded collar acceptable; wide trousers, pleats acceptable; plaque belt with hanging pendants in restrained silver or bronze - never a copy of the Cheonmachong gold belt; ankle boots over socks; birch-bark style cap or simple formal cap - never a gold or gilt-bronze crown; muted crimson or blue tones, never purple. Back view, shoulder line and cap silhouette must be consistent. Forbidden: gold crown, Joseon royal or official robes, Ming/Qing imperial dress, fantasy king styling, purple. [DDABONG_DOC_REENACTMENT_V01] DDABONG Documentary Reenactment (style B): realistic Korean facial proportions, natural skin texture with subtle imperfections, restrained expressions, historically researched clothing, natural documentary lighting, not glamorous, not glossy, not fantasy-drama, not generic Joseon hanbok. SHOT: front view, neutral expression, full head and shoulders, flat even daylight",
  "reference_images": [],
  "version": "V01",
  "parent_prompt_id": null,
  "patch_id": null,
  "created_at": "2026-09-11",
  "created_by": "Image/Video Generation Agent (Claude Code)"
}
