{
  "prompt_id": "PRM_MF_EP01_S04_MASTER_V03",
  "shot_id": "MASTER_FRAME:EP01_S04_MASTER_V01",
  "target": "IMAGE",
  "locks": {
    "global": "DDABONG_GLOBAL_V01",
    "era": "SILLA_EARLY_V01",
    "location": "LOC_CHEONMACHONG_V01",
    "character_costume": [
      "CHAR_SILLA_LABORER_GROUP_01_LOCK+COSTUME_SILLA_LABORER_A01_LOCK"
    ],
    "style": "DDABONG_DOC_REENACTMENT_V01",
    "camera": "CAMERA_EP01_S04_SH005_V01"
  },
  "shot_delta": "S04 master frame fresh generation: V01 text + full-frame (no letterbox) + wood-only tools",
  "negative": [
    "Joseon dynasty hanbok",
    "gat hats",
    "Ming or Qing court robes",
    "samurai armor",
    "European medieval armor",
    "fantasy armor",
    "giant stone palace",
    "Chinese imperial palace",
    "pagoda skyline",
    "torii gates",
    "modern tools",
    "excavators",
    "cranes",
    "concrete",
    "electric lights",
    "plastic",
    "modern roads",
    "supernatural ghosts",
    "glowing magic",
    "fantasy crown",
    "exaggerated crying",
    "battle scene",
    "cinematic war spectacle",
    "modern museum display cases",
    "text",
    "watermark",
    "glossy skin",
    "malformed anatomy",
    "Joseon-style tiled palace compound",
    "stone mausoleum / pyramid / Chinese-style tomb gateway",
    "modern tools, excavators, cranes, wheeled modern carts",
    "concrete, electric lights, plastic, modern roads",
    "supernatural ghosts, glowing magic, fantasy crown",
    "Joseon hanbok silhouette",
    "gat hat",
    "Ming/Qing dress",
    "samurai elements",
    "modern fabric",
    "purple/crimson/blue/yellow official colours"
  ],
  "assembled_text": "One wide establishing documentary photograph that fills the entire 16:9 frame edge to edge, a single still image; no black bars, no letterbox, no borders. Early Silla, Gyeongju, 5th century: the Cheonmachong burial site at an early construction stage. In the centre, a rectangular wooden outer burial chamber of thick timber beams stands on levelled ground, about 6.6 by 4.2 metres, open-topped with no lid; a low course of river stones is only beginning to line its outer walls, and nothing covers the top. The earth mound has not been raised yet; the open work area around the chamber is wide. Everyone in the image is a labourer: labourers in undyed coarse hemp short jackets with cloth waist cords, shin-bound trousers, straw sandals or bare feet, topknots or cloth headbands. At the left edge, a timber yard where labourers measure and shape beams; in the middle ground other labourers carry river stones in straw baskets toward the chamber. Use the reference image for the labourers' clothing only; faces varied, no hero figure. Tools only: straw baskets, rope, wooden poles, wooden mallets and all-wooden spades. Every tool is made entirely of wood: no metal blades, no metal heads, no saws, no pick-axes, no hoes. No one looks at the camera, no one poses. Camera about 1.6 metres high, 28mm lens feel, slightly elevated three-quarter view of the whole work area, overcast morning light, dust in the air. Photorealistic historical documentary still, style B Documentary Reenactment, natural textures and skin, not glossy, earthy natural colours. No tiled roofs, no buildings, no palace, no stone walls, no modern tools, no metal shovels or pick-axes, no rubber wheels, no cranes, no gold objects visible, no crown visible, no text, no watermark, no logo.",
  "reference_images": [
    "character_pack:CHAR_SILLA_LABORER_GROUP_01"
  ],
  "version": "V03",
  "parent_prompt_id": "PRM_MF_EP01_S04_MASTER_V02",
  "patch_id": "PATCH_MF_EP01_S04_002",
  "created_at": "2026-09-13",
  "created_by": "Image Generation Agent (Claude Code) - method change after PARTIAL edit, saved before sending (D-016), pending owner OK"
}
