{
  "prompt_id": "PRM_MP_CHAR_SILLA_ATTENDANT_GROUP_01_COSTUME_V02_SAMPLE_V01",
  "shot_id": "MASTER_PACK:CHAR_SILLA_ATTENDANT_GROUP_01:costume_v02_sample",
  "target": "IMAGE",
  "locks": {
    "global": "DDABONG_GLOBAL_V01",
    "era": "SILLA_EARLY_V01",
    "location": "NONE",
    "character_costume": [
      "CHAR_SILLA_ATTENDANT_GROUP_01_LOCK+COSTUME_SILLA_ATTENDANT_A01_LOCK_V02"
    ],
    "style": "DDABONG_SAGEUK_CINEMATIC_V02",
    "camera": null
  },
  "shot_delta": "costume V02 DRAFT sample for owner review: Korean man in his late 30s, calm, tidy, hands relaxed at his sides so the long clean sleeve cuffs read clearly.",
  "negative": [
    "Joseon dynasty hanbok",
    "gat hats",
    "Ming or Qing court robes",
    "samurai armor",
    "European medieval armor",
    "fantasy armor",
    "giant stone palace",
    "Chinese imperial palace",
    "pagoda skyline",
    "torii gates",
    "modern tools",
    "excavators",
    "cranes",
    "concrete",
    "electric lights",
    "plastic",
    "modern roads",
    "supernatural ghosts",
    "glowing magic",
    "fantasy crown",
    "exaggerated crying",
    "battle scene",
    "cinematic war spectacle",
    "modern museum display cases",
    "text",
    "watermark",
    "glossy skin",
    "malformed anatomy",
    "Joseon-style tiled palace compound",
    "stone mausoleum / pyramid / Chinese-style tomb gateway",
    "modern tools, excavators, cranes, wheeled modern carts",
    "concrete, electric lights, plastic, modern roads",
    "supernatural ghosts, glowing magic, fantasy crown",
    "Joseon hanbok silhouette",
    "court robes",
    "fantasy priest robes",
    "Chinese imperial dress",
    "official four colours",
    "gold crown",
    "silver or gold belt plaques",
    "Joseon royal or official robes",
    "Ming/Qing imperial dress",
    "fantasy king styling",
    "purple",
    "crimson",
    "plastic skin",
    "waxy complexion",
    "uncanny smooth skin",
    "blurred or deformed hands",
    "extra fingers",
    "shadow direction flip",
    "inconsistent light direction",
    "wardrobe colour change",
    "identical faces on different people",
    "anime",
    "illustration",
    "3D render look",
    "readable text",
    "captions",
    "subtitles",
    "logo",
    "short sleeves",
    "half-sleeve over-garment",
    "deep V crossover",
    "tall pointed cap",
    "bronze belt",
    "futou hat",
    "round-collar danryeong",
    "gold belt",
    "Tang-style futou hat",
    "Joseon hanbok",
    "gat hat",
    "Ming/Qing dress",
    "samurai elements",
    "modern fabric",
    "purple/crimson/blue/yellow official colours",
    "bare chest",
    "ribbon ties",
    "bronze or iron belt buckle",
    "ankle-bound trousers",
    "metal plaques",
    "official colours",
    "bare chest as default",
    "bright dye"
  ],
  "assembled_text": "Photorealistic cinematic historical documentary. Natural physical proportions. Historically plausible reconstruction. Realistic materials. Natural lighting. No fantasy. No modern objects. No text. No logos. No excessive saturation. No glossy AI look. No malformed anatomy. No arbitrary architecture changes. Early Silla, Gyeongju royal capital, 5th to early 6th century. Elite burial construction context. Modest timber work spaces, no palace spectacle. Forbidden: Joseon dynasty hanbok; gat hats; Ming or Qing court robes; samurai armor; European medieval armor; fantasy armor; giant stone palace; Joseon-style tiled palace compound; Chinese imperial palace; pagoda skyline; torii gates; stone mausoleum / pyramid / Chinese-style tomb gateway; modern tools, excavators, cranes, wheeled modern carts; concrete, electric lights, plastic, modern roads; supernatural ghosts, glowing magic, fantasy crown; modern museum display cases. CHAR_SILLA_ATTENDANT_GROUP_01 (Funeral attendant and artisan group): crowd of attendants and artisans selecting and arranging grave goods and preparing the rite; faces often out of frame, hands first. Face: varied realistic Korean faces, calm focused expressions, faces often out of frame (hands-first). Body: natural, mixed. Hair: neatly tied. Age: 20s–50s mixed. Skin: natural texture, no gloss. Costume lock: COSTUME_SILLA_ATTENDANT_A01_LOCK. COSTUME_SILLA_ATTENDANT_A01 V02 DRAFT (evidence-corrected, CLM_SILLA_COSTUME_021-031): Silla funeral attendant, 5th to early 6th century. ONE evenly woven, better-bleached plain-weave jacket, hip length or slightly longer, LONG sleeves to the wrist with clean plain cuffs, straight collar crossed shallowly (right over left or left over right), no ribbon ties; medium-width plain trousers; a neat plain cloth belt, no metal plaques, no pendants; low shoes; hair in a neat topknot, bare or with a plain cloth band; off-white, light grey or grey-brown tones, clean and tidy. MORE items than a labourer, far fewer than the elite observer: no silk, no cap of rank, no metal belt, no ankle boots. Forbidden: short sleeves, futou hat, round-collar danryeong, bronze or iron belt buckle, metal plaques, Joseon hanbok silhouette, ribbon ties, official colours. DDABONG Sageuk Cinematic Reenactment (style B2, D-051): photoreal Korean period-drama film look. Faces cast like contemporary Korean drama actors - attractive, natural, distinct from one another, never a portrait of a real person; real skin texture with visible pores, fine lines and sun marks, no gloss, no wax, no plastic. Clothing, hair, ornaments and tools strictly historically researched (early Silla), never Joseon hanbok, never fantasy. Lighting: low golden key light from a 45-degree side, soft atmospheric haze, thin warm rim light on hair and shoulders, shallow depth of field, fine film grain; night scenes lit by amber torch or lamp light against cool blue shadow. Colour: deep saturated fabrics, earth and metal, natural sky and skin, not over-saturated, not anime, not illustration. Figures still and composed; wide and medium framing preferred, faces often in profile, silhouette or backlight. COSTUME SAMPLE for owner review (not a master pack slot). Photoreal still, plain packed-earth ground, soft neutral late-afternoon daylight, simple soft background, full length head to feet, standing still, frontal three-quarter, exactly ONE person, face cast like a Korean period-drama actor but ordinary and weathered, not glamorous. No text, no watermark, no logo. Korean man in his late 30s, calm, tidy, hands relaxed at his sides so the long clean sleeve cuffs read clearly.",
  "reference_images": [],
  "version": "V01",
  "parent_prompt_id": null,
  "patch_id": null,
  "created_at": "2026-09-17",
  "created_by": "Claude Code (owner asked for visual samples instead of the research md; saved before sending)"
}
