{
  "prompt_id": "PRM_MP_CHAR_SILLA_LABORER_GROUP_01_FULL_BODY_V02",
  "shot_id": "MASTER_PACK:CHAR_SILLA_LABORER_GROUP_01:full_body",
  "target": "IMAGE",
  "locks": {
    "global": "DDABONG_GLOBAL_V01",
    "era": "SILLA_EARLY_V01",
    "location": "LOC_CHEONMACHONG_V01",
    "character_costume": [
      "CHAR_SILLA_LABORER_GROUP_01_LOCK+COSTUME_SILLA_LABORER_A01_LOCK"
    ],
    "style": "DDABONG_DOC_REENACTMENT_V01",
    "camera": null
  },
  "shot_delta": "full body head to toe, standing, arms relaxed, plain earth background, whole costume visible; three different individuals side by side, varied faces and builds, no recurring hero face",
  "negative": [
    "Joseon dynasty hanbok",
    "gat hats",
    "Ming or Qing court robes",
    "samurai armor",
    "European medieval armor",
    "fantasy armor",
    "giant stone palace",
    "Chinese imperial palace",
    "pagoda skyline",
    "torii gates",
    "modern tools",
    "excavators",
    "cranes",
    "concrete",
    "electric lights",
    "plastic",
    "modern roads",
    "supernatural ghosts",
    "glowing magic",
    "fantasy crown",
    "exaggerated crying",
    "battle scene",
    "cinematic war spectacle",
    "modern museum display cases",
    "text",
    "watermark",
    "glossy skin",
    "malformed anatomy",
    "Joseon-style tiled palace compound",
    "stone mausoleum / pyramid / Chinese-style tomb gateway",
    "modern tools, excavators, cranes, wheeled modern carts",
    "concrete, electric lights, plastic, modern roads",
    "supernatural ghosts, glowing magic, fantasy crown",
    "Joseon hanbok silhouette",
    "gat hat",
    "Ming/Qing dress",
    "samurai elements",
    "modern fabric",
    "purple/crimson/blue/yellow official colours"
  ],
  "assembled_text": "Exactly THREE different men, nobody else. Early Silla Korea, 5th century, burial-mound construction labourers. FULL BODY: head to toe, standing side by side, arms relaxed, plain flat earth background, whole costume visible. Varied realistic Korean faces, ages 20s to 40s, lean working builds, mixed heights, sun-weathered dusty skin, hair in a topknot with a cloth band or a bare topknot; no single hero face, no close-up acting. Costume on all three: undyed coarse hemp plain-weave short jacket to hip length with narrow sleeves and straight collar closing right over left, narrow trousers bound at the shin, plain cloth waist cord with no metal, straw sandals or bare feet; colours only natural white, raw fibre and black; worn, dusty cloth. Photorealistic historical documentary still, style B Documentary Reenactment, natural skin texture, not glossy, natural proportions. No Joseon hanbok silhouette, no gat hat, no Ming or Qing dress, no samurai elements, no modern fabric, no purple, crimson, blue or yellow garments. No tiled roofs, no buildings. No text, no watermark, no logo.",
  "reference_images": [],
  "version": "V02",
  "parent_prompt_id": "PRM_MP_CHAR_SILLA_LABORER_GROUP_01_FULL_BODY_V01",
  "patch_id": null,
  "created_at": "2026-09-13",
  "created_by": "Image Generation Agent (Claude Code) — crowd LITE pack, saved before sending (D-016)"
}
