{
  "prompt_id": "PRM_MP_CHAR_SILLA_ELITE_OBSERVER_01_PROFILE_V02",
  "shot_id": "MASTER_PACK:CHAR_SILLA_ELITE_OBSERVER_01:profile",
  "target": "IMAGE",
  "locks": {
    "global": "DDABONG_GLOBAL_V01",
    "era": "SILLA_EARLY_V01",
    "location": "LOC_CHEONMACHONG_V01",
    "character_costume": [
      "CHAR_SILLA_ELITE_OBSERVER_01_LOCK+COSTUME_SILLA_ELITE_A01_LOCK"
    ],
    "style": "DDABONG_DOC_REENACTMENT_V01",
    "camera": null
  },
  "shot_delta": "true profile view, showing headwear silhouette",
  "negative": [
    "Joseon dynasty hanbok",
    "gat hats",
    "Ming or Qing court robes",
    "samurai armor",
    "European medieval armor",
    "fantasy armor",
    "giant stone palace",
    "Chinese imperial palace",
    "pagoda skyline",
    "torii gates",
    "modern tools",
    "excavators",
    "cranes",
    "concrete",
    "electric lights",
    "plastic",
    "modern roads",
    "supernatural ghosts",
    "glowing magic",
    "fantasy crown",
    "exaggerated crying",
    "battle scene",
    "cinematic war spectacle",
    "modern museum display cases",
    "text",
    "watermark",
    "glossy skin",
    "malformed anatomy",
    "Joseon-style tiled palace compound",
    "stone mausoleum / pyramid / Chinese-style tomb gateway",
    "modern tools, excavators, cranes, wheeled modern carts",
    "concrete, electric lights, plastic, modern roads",
    "supernatural ghosts, glowing magic, fantasy crown",
    "gold crown",
    "silver or gold belt plaques",
    "Joseon royal or official robes",
    "Ming/Qing imperial dress",
    "fantasy king styling",
    "purple",
    "crimson"
  ],
  "assembled_text": "Use the reference images as the exact same person: keep his face identity, age, skin, hair, cap, and costume identical. Exactly ONE person, alone. TRUE SIDE PROFILE: head and body turned 90 degrees to face screen left, the full silhouette of the conical cap clearly visible, neutral expression, head and shoulders, soft even daylight, plain muted earth-toned background, no buildings. Photorealistic historical documentary still, style B Documentary Reenactment, natural skin texture, not glossy, natural proportions. Same costume: pale birch-bark style conical cap, muted dusty blue silk outer robe reaching below the knee with straight collar closing right over left, short outer sleeves over an undyed ivory hemp inner jacket with long narrow sleeves, wide grey-brown trousers, restrained bronze plaque belt with small bronze pendants, ankle-high leather boots over socks. Palette only muted blue, ivory, grey-brown, bronze. No red, no crimson, no purple. No gold crown, no gold belt. No text, no watermark, no logo. No second person.",
  "reference_images": [
    "character_pack:CHAR_SILLA_ELITE_OBSERVER_01"
  ],
  "version": "V02",
  "parent_prompt_id": "PRM_MP_CHAR_SILLA_ELITE_OBSERVER_01_PROFILE_V01",
  "patch_id": null,
  "created_at": "2026-09-13",
  "created_by": "Image Generation Agent (Claude Code) — batch 2, saved before sending (D-016); condensed reference-image form proven in batch 1"
}
