{
  "prompt_id": "PRM_MP_CHAR_SILLA_ELITE_OBSERVER_01_HERO_V06",
  "shot_id": "MASTER_PACK:CHAR_SILLA_ELITE_OBSERVER_01:hero",
  "target": "IMAGE",
  "locks": {
    "global": "DDABONG_GLOBAL_V01",
    "era": "SILLA_EARLY_V01",
    "location": "LOC_CHEONMACHONG_V01",
    "character_costume": [
      "CHAR_SILLA_ELITE_OBSERVER_01_LOCK_V02+COSTUME_SILLA_ELITE_A01_LOCK"
    ],
    "style": "DDABONG_SAGEUK_CINEMATIC_V02",
    "camera": null
  },
  "shot_delta": "recast attempt 2 (PATCH): keep V05 face + lighting, transplant COSTUME_SILLA_ELITE_A01 exactly as rendered in old hero V03 (two layers, bronze belt, conical birch-bark cap); fixes V05 costume PARTIAL",
  "negative": [
    "Joseon dynasty hanbok",
    "gat hats",
    "Ming or Qing court robes",
    "samurai armor",
    "European medieval armor",
    "fantasy armor",
    "giant stone palace",
    "Chinese imperial palace",
    "pagoda skyline",
    "torii gates",
    "modern tools",
    "excavators",
    "cranes",
    "concrete",
    "electric lights",
    "plastic",
    "modern roads",
    "supernatural ghosts",
    "glowing magic",
    "fantasy crown",
    "exaggerated crying",
    "battle scene",
    "cinematic war spectacle",
    "modern museum display cases",
    "text",
    "watermark",
    "glossy skin",
    "malformed anatomy",
    "plastic skin",
    "waxy complexion",
    "uncanny smooth skin",
    "blurred or deformed hands",
    "extra fingers",
    "shadow direction flip",
    "inconsistent light direction",
    "wardrobe colour change",
    "identical faces on different people",
    "anime",
    "illustration",
    "3D render look",
    "readable text",
    "captions",
    "subtitles",
    "logo",
    "gold crown",
    "silver or gold belt plaques",
    "purple",
    "crimson",
    "Joseon-style tiled palace compound",
    "stone mausoleum / pyramid / Chinese-style tomb gateway",
    "modern tools, excavators, cranes, wheeled modern carts",
    "concrete, electric lights, plastic, modern roads",
    "supernatural ghosts, glowing magic, fantasy crown",
    "Joseon royal or official robes",
    "Ming/Qing imperial dress",
    "fantasy king styling"
  ],
  "assembled_text": "Edit using two reference images. FIRST reference (job aff9066b) = the new man: keep his face, age, skin texture, eyebrow scar, salt-and-pepper temples, expression, head angle, camera framing, golden back-right rim light, haze, shallow depth of field, film grain, and the mound-with-scaffolding background exactly as they are. SECOND reference (job 5de27748) = the costume source only, not the face: dress the new man in exactly that costume - the pale grey-blue silk outer robe with straight collar closing right over left, worn over the ivory hemp inner jacket whose sleeves show at the cuffs, the wide bronze plaque belt with small hanging pendants, and the tall conical birch-bark cap replacing his current flat cap. Same muted blue tones, never crimson or purple, no gold crown, no gold belt. Chest-up 3:4 portrait, the belt just visible at the bottom edge. Exactly ONE person, the new face. No text, no watermark, no logo.",
  "reference_images": [
    "generation:GEN_MP_ELITE_HERO_RECAST_HIGGSFIELD_V05",
    "generation:GEN_MP_ELITE_HERO_HIGGSFIELD_V03"
  ],
  "version": "V06",
  "parent_prompt_id": "PRM_MP_CHAR_SILLA_ELITE_OBSERVER_01_HERO_V05",
  "patch_id": "PATCH_MP_ELITE_RECAST_001",
  "created_at": "2026-09-15",
  "created_by": "Claude Code (D-051 recast test #1, attempt 2 — saved before sending, Sent Prompt Rule)"
}
