{
  "prompt_id": "PRM_PA_EP01_S08_SH001_M2_V01",
  "shot_id": "EP01_S08_SH001",
  "target": "IMAGE",
  "locks": {
    "global": "DDABONG_GLOBAL_PRESENT_V01",
    "era": "NONE",
    "location": "NONE",
    "character_costume": [],
    "style": "DDABONG_DOC_REENACTMENT_V01",
    "camera": null
  },
  "shot_delta": "Montage cut 2/3 — text-only. Café element from RED captures 그림1/그림18 (not attached): eye-level, hanok café front with wooden facade and awning occupying left two-thirds (roofline y≈0.30), two or three outdoor tables with a few customers seen from behind, street lamp, a slice of the street at right with a parked small car; sunny.",
  "negative": [
    "text",
    "watermark",
    "logo",
    "signage",
    "lens flare",
    "HDR look",
    "oversaturation",
    "glossy AI look",
    "malformed anatomy",
    "identifiable faces",
    "invented buildings not in the reference",
    "altered landform or mound proportions",
    "fantasy elements",
    "historical costume figures",
    "vehicles",
    "crowds",
    "drone or aerial perspective unless in the reference"
  ],
  "assembled_text": "Photorealistic present-day documentary still, reconstructed from a licensed reference photograph. Keep the real landform, silhouette and proportions of the reference; change only season, light, weather and clutter as instructed. Natural lighting, neutral grade, realistic materials. Present-day surroundings (paths, trees, distant town) allowed only as they exist in the reference. No fantasy. No invented buildings. No text. No logos. No oversaturation. No glossy AI look. No malformed anatomy. Present-day Gyeongju, South Korea: a café in a converted hanok on Hwangnidan-gil. Photorealistic documentary still, 16:9, 4K master. Eye-level view from the opposite pavement: a low hanok building with a dark grey curved tiled roof and a warm wooden shopfront, glass doors, a cream awning, potted plants, a chalkboard-style sign with no readable writing. Three small outdoor tables in front; four customers sit with coffee, seen from behind or in profile, small, ordinary present-day clothing. At the right edge a slice of the quiet street with a small parked car and an ornate street lamp. Bright early-summer afternoon, clear sky, soft shadows. No readable text anywhere. Camera: 35 mm, height 1.6 m, tilt 0°, static frame. Documentary tone, neutral grade, slight film grain acceptable. Style B Documentary Reenactment look: natural textures, not glossy. No text, no readable signs or logos, no watermark, no lens flare, no HDR look, no oversaturation. No identifiable faces: any people are small, seen from behind or in profile at a distance.",
  "reference_images": [],
  "version": "V01",
  "parent_prompt_id": null,
  "patch_id": null,
  "created_at": "2026-09-14",
  "created_by": "Claude Code (D-034 #2 text-only, composition numbers from RED captures; D-041 batch 2; saved before sending - Sent Prompt Rule)"
}
