{
  "prompt_id": "PRM_EP01_S04_SH004_V02",
  "shot_id": "EP01_S04_SH004",
  "target": "VIDEO",
  "locks": {
    "global": "DDABONG_GLOBAL_V01",
    "era": "SILLA_EARLY_V01",
    "location": "LOC_CHEONMACHONG_V01",
    "character_costume": [
      "CHAR_SILLA_LABORER_GROUP_01_LOCK+COSTUME_SILLA_LABORER_A01_LOCK"
    ],
    "style": "DDABONG_DOC_REENACTMENT_V01",
    "camera": "CAMERA_EP01_S04_SH004_V01"
  },
  "shot_delta": "H01 video (I2V_MOTION, 6 s, silent): start image = output of PRM_EP01_S04_SH004_START_V01; motion and camera only",
  "negative": [
    "Joseon dynasty hanbok",
    "gat hats",
    "Ming or Qing court robes",
    "samurai armor",
    "European medieval armor",
    "fantasy armor",
    "giant stone palace",
    "Chinese imperial palace",
    "pagoda skyline",
    "torii gates",
    "modern tools",
    "excavators",
    "cranes",
    "concrete",
    "electric lights",
    "plastic",
    "modern roads",
    "supernatural ghosts",
    "glowing magic",
    "fantasy crown",
    "exaggerated crying",
    "battle scene",
    "cinematic war spectacle",
    "modern museum display cases",
    "text",
    "watermark",
    "glossy skin",
    "malformed anatomy",
    "Joseon-style tiled palace compound",
    "stone mausoleum / pyramid / Chinese-style tomb gateway",
    "modern tools, excavators, cranes, wheeled modern carts",
    "concrete, electric lights, plastic, modern roads",
    "supernatural ghosts, glowing magic, fantasy crown",
    "Joseon hanbok silhouette",
    "gat hat",
    "Ming/Qing dress",
    "samurai elements",
    "modern fabric",
    "purple/crimson/blue/yellow official colours",
    "cloned or repeated faces",
    "people looking at the camera",
    "lip movement or speaking",
    "coffin lowering",
    "offerings",
    "invented ritual steps",
    "earth placed before stones",
    "build order other than coffin, chamber, stones, earth"
  ],
  "assembled_text": "Slow sideways tracking shot: the camera moves steadily from left to right at a slow walking pace, about three metres over six seconds, at the same eye-level height, no zoom, no tilt, no cut. The labourers keep working naturally and continuously: two men lift and turn the long timber beam together, one slides the wooden measuring stick along the beam, one drives the wooden wedge with steady mallet strokes, two roll the log forward on wooden rollers with rope; loose dust drifts slowly in the air. Motion is calm and physical, no dramatic gestures. The chamber in the background stays open and unchanged. Keep everything in the start image unchanged: the same early Silla era, the same clothing and colours, the same faces, the same layout, the same horizon and the same light; nothing new is added to the scene. Wooden tools only. No text, no captions, no subtitles, no watermark, no logo. No modern objects, no metal tools, no utility poles, no buildings appearing. No cloned or repeated faces: every person keeps their own face for the whole shot. Nobody looks at the camera, nobody poses, nobody speaks. No invented ritual steps: no coffin lowering, no offerings placed, no bowing, no procession. The build order never changes: coffin, then wooden chamber, then stones, then earth; nothing is built out of order.",
  "reference_images": [],
  "version": "V02",
  "parent_prompt_id": "PRM_EP01_S04_SH004_V01",
  "patch_id": null,
  "created_at": "2026-09-13",
  "created_by": "Image/Video Generation Agent (Claude Code) - draft, saved before any sending (D-016), not approved"
}
