{
  "prompt_id": "PRM_MF_EP01_S04_MASTER_V04",
  "shot_id": "MASTER_FRAME:EP01_S04_MASTER_V01",
  "target": "IMAGE",
  "locks": {
    "global": "DDABONG_GLOBAL_V01",
    "era": "SILLA_EARLY_V01",
    "location": "LOC_CHEONMACHONG_V01",
    "character_costume": [
      "CHAR_SILLA_LABORER_GROUP_01_LOCK+COSTUME_SILLA_LABORER_A01_LOCK"
    ],
    "style": "DDABONG_DOC_REENACTMENT_V01",
    "camera": "CAMERA_EP01_S04_SH005_V01"
  },
  "shot_delta": "S04 master frame edit of V03: remove modern horizon (poles, wires, buildings), tape measure -> wooden stick, spade blades -> wood",
  "negative": [
    "Joseon dynasty hanbok",
    "gat hats",
    "Ming or Qing court robes",
    "samurai armor",
    "European medieval armor",
    "fantasy armor",
    "giant stone palace",
    "Chinese imperial palace",
    "pagoda skyline",
    "torii gates",
    "modern tools",
    "excavators",
    "cranes",
    "concrete",
    "electric lights",
    "plastic",
    "modern roads",
    "supernatural ghosts",
    "glowing magic",
    "fantasy crown",
    "exaggerated crying",
    "battle scene",
    "cinematic war spectacle",
    "modern museum display cases",
    "text",
    "watermark",
    "glossy skin",
    "malformed anatomy",
    "Joseon-style tiled palace compound",
    "stone mausoleum / pyramid / Chinese-style tomb gateway",
    "modern tools, excavators, cranes, wheeled modern carts",
    "concrete, electric lights, plastic, modern roads",
    "supernatural ghosts, glowing magic, fantasy crown",
    "Joseon hanbok silhouette",
    "gat hat",
    "Ming/Qing dress",
    "samurai elements",
    "modern fabric",
    "purple/crimson/blue/yellow official colours"
  ],
  "assembled_text": "Edit the reference image. Keep everything in the foreground and middle ground exactly as it is: the timber chamber, the river stones, all labourers, their faces, clothing and poses, the baskets, carrying poles, mallets, timber beams, the dust, the light and the camera angle. Change only three things: (1) the far background and horizon becomes empty 5th-century countryside - bare low hills and open untilled land with a few trees - with no utility poles, no power lines, no buildings, no greenhouses and no regular field grid; (2) the yellow tape measure in the front-left labourer's hands becomes a plain wooden measuring stick; (3) every spade blade becomes plain wood, with no metal. Full frame, no black bars, no text, no watermark, no logo.",
  "reference_images": [
    "character_pack:CHAR_SILLA_LABORER_GROUP_01"
  ],
  "version": "V04",
  "parent_prompt_id": "PRM_MF_EP01_S04_MASTER_V03",
  "patch_id": "PATCH_MF_EP01_S04_003",
  "created_at": "2026-09-13",
  "created_by": "Image Generation Agent (Claude Code) - edit, saved before sending (D-016), pending owner OK"
}
